[
  {
    "id": "t001",
    "question": "Um fazendeiro tem 17 ovelhas. Todas, exceto 9, fogem. Quantas ficam?",
    "answer": "9 ovelhas ficam.",
    "difficulty": "easy",
    "tags": ["all-ages"]
  },
  {
    "id": "t002",
    "question": "Um retângulo tem comprimento de 10 cm e largura de 11 cm. Qual é o seu perímetro?",
    "answer": "42 cm. Perímetro = 2×(10+11).",
    "difficulty": "easy",
    "tags": ["all-ages"]
  },
  {
    "id": "t003",
    "question": "Um retângulo tem comprimento de 10 cm e largura de 21 cm. Qual é o seu perímetro?",
    "answer": "62 cm. Perímetro = 2×(10+21).",
    "difficulty": "easy",
    "tags": ["all-ages"]
  },
  {
    "id": "t004",
    "question": "Um retângulo tem comprimento de 10 cm e largura de 24 cm. Qual é o seu perímetro?",
    "answer": "68 cm. Perímetro = 2×(10+24).",
    "difficulty": "easy",
    "tags": ["all-ages"]
  },
  {
    "id": "t005",
    "question": "Um retângulo tem comprimento de 11 cm e largura de 21 cm. Qual é o seu perímetro?",
    "answer": "64 cm. Perímetro = 2×(11+21).",
    "difficulty": "easy",
    "tags": ["all-ages"]
  },
  {
    "id": "t006",
    "question": "Um retângulo tem comprimento de 11 cm e largura de 7 cm. Qual é o seu perímetro?",
    "answer": "36 cm. Perímetro = 2×(11+7).",
    "difficulty": "easy",
    "tags": ["all-ages"]
  },
  {
    "id": "t007",
    "question": "Um retângulo tem comprimento de 12 cm e largura de 24 cm. Qual é o seu perímetro?",
    "answer": "72 cm. Perímetro = 2×(12+24).",
    "difficulty": "easy",
    "tags": ["all-ages"]
  },
  {
    "id": "t008",
    "question": "Um retângulo tem comprimento de 13 cm e largura de 14 cm. Qual é o seu perímetro?",
    "answer": "54 cm. Perímetro = 2×(13+14).",
    "difficulty": "easy",
    "tags": ["all-ages"]
  },
  {
    "id": "t009",
    "question": "Um retângulo tem comprimento de 13 cm e largura de 3 cm. Qual é o seu perímetro?",
    "answer": "32 cm. Perímetro = 2×(13+3).",
    "difficulty": "easy",
    "tags": ["all-ages"]
  },
  {
    "id": "t010",
    "question": "Um retângulo tem comprimento de 14 cm e largura de 16 cm. Qual é o seu perímetro?",
    "answer": "60 cm. Perímetro = 2×(14+16).",
    "difficulty": "easy",
    "tags": ["all-ages"]
  },
  {
    "id": "t011",
    "question": "Um retângulo tem comprimento de 15 cm e largura de 24 cm. Qual é o seu perímetro?",
    "answer": "78 cm. Perímetro = 2×(15+24).",
    "difficulty": "easy",
    "tags": ["all-ages"]
  },
  {
    "id": "t012",
    "question": "Um retângulo tem comprimento de 16 cm e largura de 10 cm. Qual é o seu perímetro?",
    "answer": "52 cm. Perímetro = 2×(16+10).",
    "difficulty": "easy",
    "tags": ["all-ages"]
  },
  {
    "id": "t013",
    "question": "Um retângulo tem comprimento de 16 cm e largura de 5 cm. Qual é o seu perímetro?",
    "answer": "42 cm. Perímetro = 2×(16+5).",
    "difficulty": "easy",
    "tags": ["all-ages"]
  },
  {
    "id": "t014",
    "question": "Um retângulo tem comprimento de 17 cm e largura de 16 cm. Qual é o seu perímetro?",
    "answer": "66 cm. Perímetro = 2×(17+16).",
    "difficulty": "easy",
    "tags": ["all-ages"]
  },
  {
    "id": "t015",
    "question": "Um retângulo tem comprimento de 18 cm e largura de 23 cm. Qual é o seu perímetro?",
    "answer": "82 cm. Perímetro = 2×(18+23).",
    "difficulty": "easy",
    "tags": ["all-ages"]
  },
  {
    "id": "t016",
    "question": "Um retângulo tem comprimento de 18 cm e largura de 8 cm. Qual é o seu perímetro?",
    "answer": "52 cm. Perímetro = 2×(18+8).",
    "difficulty": "easy",
    "tags": ["all-ages"]
  },
  {
    "id": "t017",
    "question": "Um retângulo tem comprimento de 22 cm e largura de 13 cm. Qual é o seu perímetro?",
    "answer": "70 cm. Perímetro = 2×(22+13).",
    "difficulty": "easy",
    "tags": ["all-ages"]
  },
  {
    "id": "t018",
    "question": "Um retângulo tem comprimento de 22 cm e largura de 16 cm. Qual é o seu perímetro?",
    "answer": "76 cm. Perímetro = 2×(22+16).",
    "difficulty": "easy",
    "tags": ["all-ages"]
  },
  {
    "id": "t019",
    "question": "Um retângulo tem comprimento de 23 cm e largura de 11 cm. Qual é o seu perímetro?",
    "answer": "68 cm. Perímetro = 2×(23+11).",
    "difficulty": "easy",
    "tags": ["all-ages"]
  },
  {
    "id": "t020",
    "question": "Um retângulo tem comprimento de 23 cm e largura de 17 cm. Qual é o seu perímetro?",
    "answer": "80 cm. Perímetro = 2×(23+17).",
    "difficulty": "easy",
    "tags": ["all-ages"]
  },
  {
    "id": "t021",
    "question": "Um retângulo tem comprimento de 24 cm e largura de 24 cm. Qual é o seu perímetro?",
    "answer": "96 cm. Perímetro = 2×(24+24).",
    "difficulty": "easy",
    "tags": ["all-ages"]
  },
  {
    "id": "t022",
    "question": "Um retângulo tem comprimento de 25 cm e largura de 8 cm. Qual é o seu perímetro?",
    "answer": "66 cm. Perímetro = 2×(25+8).",
    "difficulty": "easy",
    "tags": ["all-ages"]
  },
  {
    "id": "t023",
    "question": "Um retângulo tem comprimento de 3 cm e largura de 22 cm. Qual é o seu perímetro?",
    "answer": "50 cm. Perímetro = 2×(3+22).",
    "difficulty": "easy",
    "tags": ["all-ages"]
  },
  {
    "id": "t024",
    "question": "Um retângulo tem comprimento de 3 cm e largura de 24 cm. Qual é o seu perímetro?",
    "answer": "54 cm. Perímetro = 2×(3+24).",
    "difficulty": "easy",
    "tags": ["all-ages"]
  },
  {
    "id": "t025",
    "question": "Um retângulo tem comprimento de 3 cm e largura de 5 cm. Qual é o seu perímetro?",
    "answer": "16 cm. Perímetro = 2×(3+5).",
    "difficulty": "easy",
    "tags": ["all-ages"]
  },
  {
    "id": "t026",
    "question": "Um retângulo tem comprimento de 5 cm e largura de 21 cm. Qual é o seu perímetro?",
    "answer": "52 cm. Perímetro = 2×(5+21).",
    "difficulty": "easy",
    "tags": ["all-ages"]
  },
  {
    "id": "t027",
    "question": "Um retângulo tem comprimento de 6 cm e largura de 23 cm. Qual é o seu perímetro?",
    "answer": "58 cm. Perímetro = 2×(6+23).",
    "difficulty": "easy",
    "tags": ["all-ages"]
  },
  {
    "id": "t028",
    "question": "Um retângulo tem comprimento de 6 cm e largura de 4 cm. Qual é o seu perímetro?",
    "answer": "20 cm. Perímetro = 2×(6+4).",
    "difficulty": "easy",
    "tags": ["all-ages"]
  },
  {
    "id": "t029",
    "question": "Um retângulo tem comprimento de 7 cm e largura de 11 cm. Qual é o seu perímetro?",
    "answer": "36 cm. Perímetro = 2×(7+11).",
    "difficulty": "easy",
    "tags": ["all-ages"]
  },
  {
    "id": "t030",
    "question": "Um retângulo tem comprimento de 7 cm e largura de 7 cm. Qual é o seu perímetro?",
    "answer": "28 cm. Perímetro = 2×(7+7).",
    "difficulty": "easy",
    "tags": ["all-ages"]
  },
  {
    "id": "t031",
    "question": "Um triângulo tem lados de 3 cm, 4 cm e 5 cm. Que tipo de ângulo ele contém?",
    "answer": "Um ângulo reto.",
    "difficulty": "easy",
    "tags": ["all-ages"]
  },
  {
    "id": "t032",
    "question": "Complete o espaço em branco: 10 + 19 = ___.",
    "answer": "29",
    "difficulty": "easy",
    "tags": ["all-ages"]
  },
  {
    "id": "t033",
    "question": "Complete o espaço em branco: 13 - 94 = ___.",
    "answer": "-81",
    "difficulty": "easy",
    "tags": ["all-ages"]
  },
  {
    "id": "t034",
    "question": "Complete o espaço em branco: 17 + 84 = ___.",
    "answer": "101",
    "difficulty": "easy",
    "tags": ["all-ages"]
  },
  {
    "id": "t035",
    "question": "Complete o espaço em branco: 18 + 14 = ___.",
    "answer": "32",
    "difficulty": "easy",
    "tags": ["all-ages"]
  },
  {
    "id": "t036",
    "question": "Complete o espaço em branco: 19 × 85 = ___.",
    "answer": "1615",
    "difficulty": "easy",
    "tags": ["all-ages"]
  },
  {
    "id": "t037",
    "question": "Complete o espaço em branco: 21 + 45 = ___.",
    "answer": "66",
    "difficulty": "easy",
    "tags": ["all-ages"]
  },
  {
    "id": "t038",
    "question": "Complete o espaço em branco: 23 × 99 = ___.",
    "answer": "2277",
    "difficulty": "easy",
    "tags": ["all-ages"]
  },
  {
    "id": "t039",
    "question": "Complete o espaço em branco: 25 + 34 = ___.",
    "answer": "59",
    "difficulty": "easy",
    "tags": ["all-ages"]
  },
  {
    "id": "t040",
    "question": "Complete o espaço em branco: 27 + 75 = ___.",
    "answer": "102",
    "difficulty": "easy",
    "tags": ["all-ages"]
  },
  {
    "id": "t041",
    "question": "Complete o espaço em branco: 27 × 23 = ___.",
    "answer": "621",
    "difficulty": "easy",
    "tags": ["all-ages"]
  },
  {
    "id": "t042",
    "question": "Complete o espaço em branco: 29 × 57 = ___.",
    "answer": "1653",
    "difficulty": "easy",
    "tags": ["all-ages"]
  },
  {
    "id": "t043",
    "question": "Complete o espaço em branco: 30 + 49 = ___.",
    "answer": "79",
    "difficulty": "easy",
    "tags": ["all-ages"]
  },
  {
    "id": "t044",
    "question": "Complete o espaço em branco: 30 - 69 = ___.",
    "answer": "-39",
    "difficulty": "easy",
    "tags": ["all-ages"]
  },
  {
    "id": "t045",
    "question": "Complete o espaço em branco: 31 - 62 = ___.",
    "answer": "-31",
    "difficulty": "easy",
    "tags": ["all-ages"]
  },
  {
    "id": "t046",
    "question": "Complete o espaço em branco: 32 + 80 = ___.",
    "answer": "112",
    "difficulty": "easy",
    "tags": ["all-ages"]
  },
  {
    "id": "t047",
    "question": "Complete o espaço em branco: 32 - 99 = ___.",
    "answer": "-67",
    "difficulty": "easy",
    "tags": ["all-ages"]
  },
  {
    "id": "t048",
    "question": "Complete o espaço em branco: 34 + 78 = ___.",
    "answer": "112",
    "difficulty": "easy",
    "tags": ["all-ages"]
  },
  {
    "id": "t049",
    "question": "Complete o espaço em branco: 37 × 71 = ___.",
    "answer": "2627",
    "difficulty": "easy",
    "tags": ["all-ages"]
  },
  {
    "id": "t050",
    "question": "Complete o espaço em branco: 43 × 60 = ___.",
    "answer": "2580",
    "difficulty": "easy",